[
  {
    "champion_name": "Aatrox",
    "role": "top",
    "damage_focus": "physical",
    "power_curve": "mid",
    "resource_demand": "high",
    "execution_demand": 4,
    "spike_notes": [
      "First completed item",
      "Rank-two ultimate and coordinated mid-game fights"
    ],
    "reasoning": "Aatrox converts levels, ability haste and sustained access into a strong mid-game fight. His output depends on landing chained abilities and receiving enough resources to survive through healing windows.",
    "patch": "unknown",
    "assessment_method": "manual",
    "confidence": 0.65,
    "review_status": "provisional",
    "source_name": "RiftTheory manual coaching review"
  },
  {
    "champion_name": "Annie",
    "role": "mid",
    "damage_focus": "magic",
    "power_curve": "early_mid",
    "resource_demand": "medium",
    "execution_demand": 2,
    "spike_notes": ["Level 6", "First burst item", "Flash plus stun available"],
    "reasoning": "Annie offers a direct burst-and-engage plan whose most important windows depend on stun preparation and access to the target rather than a complex mechanical sequence.",
    "patch": "unknown",
    "assessment_method": "manual",
    "confidence": 0.7,
    "review_status": "provisional",
    "source_name": "RiftTheory manual coaching review"
  },
  {
    "champion_name": "Aphelios",
    "role": "bot",
    "damage_focus": "physical",
    "power_curve": "late",
    "resource_demand": "high",
    "execution_demand": 5,
    "spike_notes": [
      "Multiple completed carry items",
      "Prepared weapon cycle before an objective"
    ],
    "reasoning": "Aphelios is a resource-intensive carry whose fight output rises with items and deliberate weapon preparation. The composition must create safe space and arrive with the correct setup.",
    "patch": "unknown",
    "assessment_method": "manual",
    "confidence": 0.7,
    "review_status": "provisional",
    "source_name": "RiftTheory manual coaching review"
  },
  {
    "champion_name": "Braum",
    "role": "support",
    "damage_focus": "utility",
    "power_curve": "timing_dependent",
    "resource_demand": "low",
    "execution_demand": 3,
    "spike_notes": [
      "Level 6",
      "Defensive item completion",
      "Enemy commitment into protected carries"
    ],
    "reasoning": "Braum contributes primarily through protection, counter-engage and passive coordination. His value depends more on enemy access patterns and allied follow-up than personal gold.",
    "patch": "unknown",
    "assessment_method": "manual",
    "confidence": 0.7,
    "review_status": "provisional",
    "source_name": "RiftTheory manual coaching review"
  },
  {
    "champion_name": "Caitlyn",
    "role": "bot",
    "damage_focus": "physical",
    "power_curve": "timing_dependent",
    "resource_demand": "high",
    "execution_demand": 4,
    "spike_notes": [
      "Early lane range advantage",
      "First completed item",
      "Multi-item critical-strike scaling"
    ],
    "reasoning": "Caitlyn can create early lane and structure pressure, but the draft must convert that control and bridge item-dependent troughs. Trap setup and protected range determine later fight access.",
    "patch": "unknown",
    "assessment_method": "manual",
    "confidence": 0.65,
    "review_status": "provisional",
    "source_name": "RiftTheory manual coaching review"
  },
  {
    "champion_name": "Ezreal",
    "role": "bot",
    "damage_focus": "mixed",
    "power_curve": "mid",
    "resource_demand": "high",
    "execution_demand": 4,
    "spike_notes": ["First spellblade completion", "Two-item poke window"],
    "reasoning": "Ezreal converts early item completions and repeated skill-shot access into mid-game pressure. His safety is valuable, but missed abilities sharply reduce the composition's damage output.",
    "patch": "unknown",
    "assessment_method": "manual",
    "confidence": 0.65,
    "review_status": "provisional",
    "source_name": "RiftTheory manual coaching review"
  },
  {
    "champion_name": "Lee Sin",
    "role": "jungle",
    "damage_focus": "physical",
    "power_curve": "early_mid",
    "resource_demand": "medium",
    "execution_demand": 5,
    "spike_notes": [
      "Early levels with access to all basic abilities",
      "Level 6",
      "First completed item"
    ],
    "reasoning": "Lee Sin creates early access, skirmish and displacement windows. The value of the pick depends on converting tempo and executing the correct role as raw damage becomes less central later.",
    "patch": "unknown",
    "assessment_method": "manual",
    "confidence": 0.65,
    "review_status": "provisional",
    "source_name": "RiftTheory manual coaching review"
  },
  {
    "champion_name": "Vi",
    "role": "jungle",
    "damage_focus": "physical",
    "power_curve": "early_mid",
    "resource_demand": "medium",
    "execution_demand": 3,
    "spike_notes": [
      "Level 6",
      "First completed item",
      "Ultimate available against an exposed carry"
    ],
    "reasoning": "Vi provides reliable single-target access and a direct engage signal. She is strongest when the composition can immediately follow her commitment and convert the isolated target.",
    "patch": "unknown",
    "assessment_method": "manual",
    "confidence": 0.7,
    "review_status": "provisional",
    "source_name": "RiftTheory manual coaching review"
  },
  {
    "champion_name": "Xerath",
    "role": "mid",
    "damage_focus": "magic",
    "power_curve": "mid_late",
    "resource_demand": "high",
    "execution_demand": 4,
    "spike_notes": [
      "First mana item",
      "Two-item poke window",
      "Objective setup before enemy arrival"
    ],
    "reasoning": "Xerath converts items and prepared space into long-range health advantages. His output is execution-sensitive and drops when opponents bypass the setup phase.",
    "patch": "unknown",
    "assessment_method": "manual",
    "confidence": 0.65,
    "review_status": "provisional",
    "source_name": "RiftTheory manual coaching review"
  },
  {
    "champion_name": "Xerath",
    "role": "support",
    "damage_focus": "magic",
    "power_curve": "early_mid",
    "resource_demand": "medium",
    "execution_demand": 4,
    "spike_notes": [
      "Early lane range window",
      "Level 6",
      "First support damage-item completion"
    ],
    "reasoning": "Support Xerath trades lower guaranteed income for early range pressure. The pick must create lane or setup value while avoiding direct engage and flank access.",
    "patch": "unknown",
    "assessment_method": "manual",
    "confidence": 0.6,
    "review_status": "provisional",
    "source_name": "RiftTheory manual coaching review"
  },
  {
    "champion_name": "Zyra",
    "role": "support",
    "damage_focus": "magic",
    "power_curve": "early_mid",
    "resource_demand": "medium",
    "execution_demand": 3,
    "spike_notes": [
      "Level 6",
      "First damage-item completion",
      "Prepared seeds around an objective"
    ],
    "reasoning": "Zyra creates lane pressure and prepared zone control without requiring carry-level income. Her strongest fights begin in controlled terrain before opponents gain clean access.",
    "patch": "unknown",
    "assessment_method": "manual",
    "confidence": 0.65,
    "review_status": "provisional",
    "source_name": "RiftTheory manual coaching review"
  },
  {
    "champion_name": "Ashe",
    "role": "bot",
    "damage_focus": "physical",
    "power_curve": "early_mid",
    "resource_demand": "medium",
    "execution_demand": 3,
    "spike_notes": [
      "Level 6",
      "First completed utility damage item",
      "Vision-controlled arrow angle before an objective"
    ],
    "reasoning": "Ashe gives bot lane reliable initiation, chase control and pick access without needing the highest economy share. Her draft value rises when the team can convert Hawkshot information and Enchanted Crystal Arrow into coordinated first moves.",
    "patch": "unknown",
    "assessment_method": "manual",
    "confidence": 0.65,
    "review_status": "provisional",
    "source_name": "RiftTheory manual coaching review"
  },
  {
    "champion_name": "Draven",
    "role": "bot",
    "damage_focus": "physical",
    "power_curve": "early",
    "resource_demand": "high",
    "execution_demand": 5,
    "spike_notes": [
      "Level 2 lane threat",
      "First completed damage item",
      "Adoration cash-in window"
    ],
    "reasoning": "Draven is a lane-pressure and snowball carry whose draft asks for early support, wave access and protection against forced resets. If the team cannot convert his first windows, his resource demand becomes a structural cost.",
    "patch": "unknown",
    "assessment_method": "manual",
    "confidence": 0.65,
    "review_status": "provisional",
    "source_name": "RiftTheory manual coaching review"
  },
  {
    "champion_name": "Jhin",
    "role": "bot",
    "damage_focus": "physical",
    "power_curve": "mid_late",
    "resource_demand": "high",
    "execution_demand": 4,
    "spike_notes": [
      "Level 6 long-range follow-up",
      "First completed carry item",
      "Two- to three-item pick and objective setup"
    ],
    "reasoning": "Jhin supports picks and engages from range before converting control into burst damage. He needs prepared spacing and struggles to provide continuous damage into several durable targets without allied setup.",
    "patch": "unknown",
    "assessment_method": "manual",
    "confidence": 0.7,
    "review_status": "provisional",
    "source_name": "RiftTheory manual coaching review"
  },
  {
    "champion_name": "Jinx",
    "role": "bot",
    "damage_focus": "physical",
    "power_curve": "late",
    "resource_demand": "high",
    "execution_demand": 3,
    "spike_notes": [
      "Two-item sustained damage window",
      "Reset chain after first takedown",
      "Protected late-game objective fight"
    ],